submission_code,submission_date,submission_status,submission_description,initiator_id,initiator_legalname,initiator_address,initiator_region,item_amount,item_classification
010624-040A8668,2024-06-01T17:36:27.658298Z,pending,Харчоблок базової кухні,4394869,ВЕЛИКОБІРКІВСЬКА СЕЛИЩНА РАДА,"Тернопільська обл., Тернопільський р-н, селище міського типу Великі Бірки, ВУЛИЦЯ ГРУШЕВСЬКОГО, будинок 53",Тернопільська,3967203.0,kitchen
020624-2C34FAB7,2024-06-02T16:32:18.130273Z,pending,харчоблок,2146222,"УПРАВЛІННЯ ОСВІТИ, МОЛОДІ ТА СПОРТУ ЛОЗІВСЬКОЇ МІСЬКОЇ РАДИ ХАРКІВСЬКОЇ ОБЛАСТІ","Харківська обл., місто Лозова, МІКРОРАЙОН 1, будинок 1",Харківська,9607874.0,kitchen
020624-9F163A6A,2024-06-02T18:06:32.388695Z,pending,харчоблок,2146222,"УПРАВЛІННЯ ОСВІТИ, МОЛОДІ ТА СПОРТУ ЛОЗІВСЬКОЇ МІСЬКОЇ РАДИ ХАРКІВСЬКОЇ ОБЛАСТІ","Харківська обл., місто Лозова, МІКРОРАЙОН 1, будинок 1",Харківська,16569763.0,kitchen
020624-D8610EBB,2024-06-02T17:09:51.508281Z,pending,харчоблок,2146222,"УПРАВЛІННЯ ОСВІТИ, МОЛОДІ ТА СПОРТУ ЛОЗІВСЬКОЇ МІСЬКОЇ РАДИ ХАРКІВСЬКОЇ ОБЛАСТІ","Харківська обл., місто Лозова, МІКРОРАЙОН 1, будинок 1",Харківська,20051019.0,kitchen
020624-E1B2F3B0,2024-06-02T16:20:55.533024Z,pending,харчоблок,2146222,"УПРАВЛІННЯ ОСВІТИ, МОЛОДІ ТА СПОРТУ ЛОЗІВСЬКОЇ МІСЬКОЇ РАДИ ХАРКІВСЬКОЇ ОБЛАСТІ","Харківська обл., місто Лозова, МІКРОРАЙОН 1, будинок 1",Харківська,16166182.0,kitchen
030524-50D8D8D4,2024-05-03T12:07:51.329076Z,pending,Нове будівництво захисної споруди(протирадіаційне укриття),41023548,УПРАВЛІННЯ ОСВІТИ ІЛЛІНЕЦЬКОЇ МІСЬКОЇ РАДИ,"Вінницька обл., Вінницький р-н, місто Іллінці, вул.Соборна, будинок 25",Вінницька,2130000.0,shelter
030524-9A4FA6C2,2024-05-03T08:03:08.298875Z,withdrawn,Нове будівництво захисної споруди(протирадіаційне укриття),41023548,УПРАВЛІННЯ ОСВІТИ ІЛЛІНЕЦЬКОЇ МІСЬКОЇ РАДИ,"Вінницька обл., Вінницький р-н, місто Іллінці, вул.Соборна, будинок 25",Вінницька,2130000.0,shelter
030624-0254134E,2024-06-03T10:19:13.473846Z,pending,харчоблок,2146222,"УПРАВЛІННЯ ОСВІТИ, МОЛОДІ ТА СПОРТУ ЛОЗІВСЬКОЇ МІСЬКОЇ РАДИ ХАРКІВСЬКОЇ ОБЛАСТІ","Харківська обл., місто Лозова, МІКРОРАЙОН 1, будинок 1",Харківська,7953965.0,kitchen
030624-4A06B79A,2024-06-03T09:28:50.100534Z,withdrawn,харчоблок,2146222,"УПРАВЛІННЯ ОСВІТИ, МОЛОДІ ТА СПОРТУ ЛОЗІВСЬКОЇ МІСЬКОЇ РАДИ ХАРКІВСЬКОЇ ОБЛАСТІ","Харківська обл., місто Лозова, МІКРОРАЙОН 1, будинок 1",Харківська,8654862.5,kitchen
030624-6D756825,2024-06-03T10:31:36.383954Z,pending,харчоблок,2146222,"УПРАВЛІННЯ ОСВІТИ, МОЛОДІ ТА СПОРТУ ЛОЗІВСЬКОЇ МІСЬКОЇ РАДИ ХАРКІВСЬКОЇ ОБЛАСТІ","Харківська обл., місто Лозова, МІКРОРАЙОН 1, будинок 1",Харківська,8748755.0,kitchen
030624-960B886B,2024-06-03T08:52:20.586237Z,pending,харчоблок,2146222,"УПРАВЛІННЯ ОСВІТИ, МОЛОДІ ТА СПОРТУ ЛОЗІВСЬКОЇ МІСЬКОЇ РАДИ ХАРКІВСЬКОЇ ОБЛАСТІ","Харківська обл., місто Лозова, МІКРОРАЙОН 1, будинок 1",Харківська,14457921.0,kitchen
030624-CF90641F,2024-06-03T09:58:17.156161Z,pending,харчоблок,2146222,"УПРАВЛІННЯ ОСВІТИ, МОЛОДІ ТА СПОРТУ ЛОЗІВСЬКОЇ МІСЬКОЇ РАДИ ХАРКІВСЬКОЇ ОБЛАСТІ","Харківська обл., місто Лозова, МІКРОРАЙОН 1, будинок 1",Харківська,9931071.0,kitchen
030624-D1C0D523,2024-06-03T09:35:21.011773Z,pending,харчоблок,2146222,"УПРАВЛІННЯ ОСВІТИ, МОЛОДІ ТА СПОРТУ ЛОЗІВСЬКОЇ МІСЬКОЇ РАДИ ХАРКІВСЬКОЇ ОБЛАСТІ","Харківська обл., місто Лозова, МІКРОРАЙОН 1, будинок 1",Харківська,22608455.0,kitchen
040624-8927B25E,2024-06-04T10:36:58.587726Z,approval,Пнівський ліцей,4354686,ПАСІЧНЯНСЬКА СІЛЬСЬКА РАДА,"Івано-Франківська обл., Надвірнянський р-н, село Пасічна, ВУЛИЦЯ СОФІЇ ГАЛЕЧКО, будинок 127",Івано-Франківська,4372182.0,kitchen
180424-0916950F,2024-04-23T09:20:31.828563Z,pending,"Нове будівництво протирадіаційного укриття (ПРУ) для Криворізької гімназії №89 ""Потенціал"" Криворізької міської ради за адресою: вул. Мальовнича, буд. 1А, м. Кривий Ріг, Дніпропетровської обл., 50054",4011650,ДЕПАРТАМЕНТ КАПІТАЛЬНОГО БУДІВНИЦТВА ДНІПРОПЕТРОВСЬКОЇ ОБЛАСНОЇ ДЕРЖАВНОЇ АДМІНІСТРАЦІЇ,"Дніпропетровська обл., місто Дніпро, ВУЛИЦЯ СТАРОКОЗАЦЬКА, будинок 34",Дніпропетровська,29745975.0,shelter
180424-0CDD41AE,2024-04-22T11:35:41.329898Z,withdrawn,Укриття,44155417,"ВІДДІЛ ОСВІТИ, КУЛЬТУРИ, МОЛОДІ ТА СПОРТУ ОЛЕКСАНДРІВСЬКОЇ СЕЛИЩНОЇ РАДИ","Миколаївська обл., Вознесенський р-н, селище міського типу Олександрівка, вул.Подзігуна генерала, будинок 208",Миколаївська,21546438.7,shelter
180424-2429FBB5,2024-04-22T04:55:47.969600Z,withdrawn,"Нове будівництво ПРУ для Стецьківського закладу загальної середньої освіти І-ІІІ ступенів Сумської міської ради за адресою: вул.Шкільна, 5, с. Стецьківка, Сумського району, Сумської області",433331,УПРАВЛІННЯ КАПІТАЛЬНОГО БУДІВНИЦТВА ТА ДОРОЖНЬОГО ГОСПОДАРСТВА СУМСЬКОЇ МІСЬКОЇ РАДИ,"Сумська обл., місто Суми, ВУЛИЦЯ ПЕТРОПАВЛІВСЬКА, будинок 91",Сумська,17211412.0,shelter
180424-34D5A373,2024-04-19T14:08:23.464406Z,approval,"Капітальний ремонт частини підвального приміщення - найпростішого укриття опорного закладу «Оржицька ЗОШ І-ІІІ ступенів імені І.Я.Франка Оржицької селищної ради Полтавської області», по вулиці Центральна,16, смт Оржиця, Лубенського району Полтавської області",21054106,ОРЖИЦЬКА СЕЛИЩНА РАДА,"Полтавська обл., Лубенський р-н, селище міського типу Оржиця, вул.Центральна, будинок 24",Полтавська,2648738.0,shelter
180424-3A77C64B,2024-04-18T11:40:34.850941Z,pending,"«Нове будівництво укриття (ПРУ) для Маньківського закладу загальної середньої освіти І-ІІІ ступенів №1 Маньківської селищної ради Черкаської області по вул. Благодатна, 3, смт Маньківка, Маньківська територіальна громада, Уманський район, Черкаська область»",44118951,"ВІДДІЛ ОСВІТИ, МОЛОДІ ТА СПОРТУ МАНЬКІВСЬКОЇ СЕЛИЩНОЇ РАДИ ЧЕРКАСЬКОЇ ОБЛАСТІ","Черкаська обл., Уманський р-н, селище міського типу Маньківка, вул.Шевченка, будинок 19",Черкаська,9545350.6,shelter
180424-4CBF3304,2024-04-19T12:29:05.171357Z,withdrawn,"Капітальний ремонт підвальних приміщень з пристосуванням їх для використання як найпростішого укриття в будівлі Великочернеччинського закладу загальної середньої освіти І-ІІІ ступенів Сумської міської ради за адресою: Сумська обл., Сумський район, с. В.Чернеччина, вул. Центральна, 8",33361929,ВЕЛИКОЧЕРНЕЧЧИНСЬКИЙ ЗАКЛАД ЗАГАЛЬНОЇ СЕРЕДНЬОЇ ОСВІТИ І-ІІІ СТУПЕНІВ СУМСЬКОЇ МІСЬКОЇ РАДИ,"Сумська обл., Сумський р-н, село Велика Чернеччина, ВУЛИЦЯ ЦЕНТРАЛЬНА, будинок 8",Сумська,5284047.0,shelter
180424-70E8D145,2024-04-25T16:37:22.493589Z,pending,"Реконструкція частини підвалу корпусу №2 Миколаївського ліцею №38 імені Володимира Дмитровича Чайки Миколаївської міської ради Миколаївської області для розміщення захисної споруди цивільного захисту по вул. Потьомкінська, 147А у м. Миколаєві",26565573,МИКОЛАЇВСЬКА МІСЬКА РАДА,"Миколаївська обл., місто Миколаїв, ВУЛИЦЯ АДМІРАЛЬСЬКА, будинок 20",Миколаївська,17558453.0,shelter
180424-731B5445,2024-04-24T10:10:27.676487Z,approval,Споруда подвiйного призначення iз захисними властивостями протирадiацiйного укриття,44114014,ВІДДІЛ ОСВІТИ БАЛАКЛІЙСЬКОЇ МІСЬКОЇ РАДИ ХАРКІВСЬКОЇ ОБЛАСТІ,"Харківська обл., Ізюмський р-н, місто Балаклія, вул.Жовтнева, будинок 18",Харківська,116653180.5,shelter
180424-9C4251DC,2024-04-23T11:03:51.779341Z,active,Будівництво захисної споруди цивільного захисту,22978663,УПРАВЛІННЯ ОСВІТИ ШОСТКИНСЬКОЇ МІСЬКОЇ РАДИ,"Сумська обл., місто Шостка, ВУЛИЦЯ САДОВИЙ БУЛЬВАР, будинок 9",Сумська,6824834.0,shelter
180424-A31CCC36,2024-04-23T08:03:47.606197Z,withdrawn,"Капітальний ремонт захисної споруди цивільного захисту (протирадіаційне укриття №76528) Комунального закладу ""Богодухівський ліцей №3"" Богодухівської міської ради Богодухівського району Харківської області",44104781,"Управління освіти, молоді та спорту Богодухівської міської ради Харківської області","Україна, Харківська обл., Богодухівський р-н, місто Богодухів, вул.Троїцька, будинок 15",Харківська,21602811.0,shelter
180424-AA069ED4,2024-04-22T11:58:47.017378Z,unsuccessful,Укриття,14253727,КУЛИКІВСЬКИЙ ЛІЦЕЙ КУЛИКІВСЬКОЇ СЕЛИЩНОЇ РАДИ ЧЕРНІГІВСЬКОГО РАЙОНУ ЧЕРНІГІВСЬКОЇ ОБЛАСТІ,"Чернігівська обл., Чернігівський р-н, селище міського типу Куликівка, вул.Шевченка, будинок 4",Чернігівська,8763880.0,shelter
180424-CBE44199,2024-04-25T15:58:11.399064Z,pending,Будівництво шкільної їдальні з ПРУ 4 класу безпеки на підвальному поверсі,5582159,ТАЇРОВСЬКА СЕЛИЩНА РАДА ОДЕСЬКОГО РАЙОНУ ОДЕСЬКОЇ ОБЛАСТІ,"Одеський р-н, селище міського типу Таїрове, вул.40-річчя Перемоги, будинок 27",Одеська,191742361.0,shelter
190424-146841C4,2024-04-25T05:33:25.192102Z,withdrawn,Протирадіаційне укриття (споруда цивільного захисту),26372644,ПУШКАРІВСЬКИЙ ЛІЦЕЙ ВЕРХНЬОДНІПРОВСЬКОЇ МІСЬКОЇ РАДИ,"Дніпропетровська обл., Кам'янський р-н, село Пушкарівка, вул.Ілляшевської Варвари, будинок 20",Дніпропетровська,11365073.0,shelter
190424-683127CD,2024-04-26T06:07:26.209805Z,approval,"«Нове будівництво захисної споруди цивільного захисту в Комунальному закладі «Малинівський опорний ліцей №1» Малинівської селищної ради Чугуївського району Харківської області за адресою: Харківська область, Чугуївський район, смт Малинівка, вул. Михайлівська, 71»",41851276,"ВІДДІЛ ОСВІТИ, КУЛЬТУРИ, СПОРТУ ТА МОЛОДІ МАЛИНІВСЬКОЇ СЕЛИЩНОЇ РАДИ ЧУГУЇВСЬКОГО РАЙОНУ ХАРКІВСЬКОЇ ОБЛАСТІ","Харківська обл., Чугуївський р-н, селище міського типу Малинівка, ВУЛИЦЯ СОЇЧА, будинок 5, корпус А",Харківська,85031226.9,shelter
190424-85DEEE8E,2024-04-22T11:15:59.082326Z,active,Будівництво захисної споруди цивільного захисту,22978663,УПРАВЛІННЯ ОСВІТИ ШОСТКИНСЬКОЇ МІСЬКОЇ РАДИ,"Сумська обл., місто Шостка, ВУЛИЦЯ САДОВИЙ БУЛЬВАР, будинок 9",Сумська,17737079.0,shelter
190424-94557C5F,2024-04-24T06:36:30.742500Z,withdrawn,Захисна споруда цивільного захисту ПРУ,33251710,ПРИЛУЦЬКИЙ ЛІЦЕЙ № 14 ПРИЛУЦЬКОЇ МІСЬКОЇ РАДИ ЧЕРНІГІВСЬКОЇ ОБЛАСТІ,"Чернігівська обл., місто Прилуки, ВУЛИЦЯ САДОВА, будинок 106",Чернігівська,25356911.0,shelter
190424-AB40FFAB,2024-04-25T09:52:04.106653Z,unsuccessful,Протирадіаційне укриття,4412656,СОСНИЦЬКА СЕЛИЩНА РАДА,"Чернігівська обл., Корюківський р-н, селище міського типу Сосниця, вул.Грушевського, будинок 15",Чернігівська,31023344.8,shelter
190424-C37E826E,2024-04-23T08:55:49.891799Z,pending,"Нове будівництво протирадіаційного укриття (ПРУ) для Криворізького ліцею №95 Криворізької міської  ради за адресою: вул. Соборності, буд. 20А, м. Кривий Ріг, Дніпропетровська обл., 50006",4011650,ДЕПАРТАМЕНТ КАПІТАЛЬНОГО БУДІВНИЦТВА ДНІПРОПЕТРОВСЬКОЇ ОБЛАСНОЇ ДЕРЖАВНОЇ АДМІНІСТРАЦІЇ,"Дніпропетровська обл., місто Дніпро, ВУЛИЦЯ СТАРОКОЗАЦЬКА, будинок 34",Дніпропетровська,43241572.0,shelter
190424-D27C89D3,2024-04-19T12:08:07.213566Z,withdrawn,Протирадіаційне укриття Сухополов'янського ліцею Сухополов'янської сільської ради,4415867,СУХОПОЛОВ'ЯНСЬКА СІЛЬСЬКА РАДА,"Чернігівська обл., Прилуцький р-н, село Сухополова, ВУЛИЦЯ ЧЕРНІГІВСЬКА, будинок 32",Чернігівська,4206087.2,shelter
190424-DDC1F3CC,2024-04-24T11:45:09.950061Z,withdrawn,ПРУ,4061990,БОБРОВИЦЬКА МІСЬКА РАДА ЧЕРНІГІВСЬКОЇ ОБЛАСТІ,"Чернігівська обл., Ніжинський р-н, місто Бобровиця, вул.Незалежності, будинок 46",Чернігівська,6430453.2,shelter
200424-B7A30336,2024-04-20T08:51:40.771912Z,withdrawn,"Протирадіаційне укриття у Прибузькому ліцеї Прибузької с\р Миколаївської області, Вознесенського району, с.Прибужжя, вул.Соборна, 52/А",20893891,ПРИБУЗЬКИЙ ЛІЦЕЙ З ГІМНАЗІЄЮ ТА ПОЧАТКОВОЮ ШКОЛОЮ ПРИБУЗЬКОЇ СІЛЬСЬКОЇ РАДИ МИКОЛАЇВСЬКОЇ ОБЛАСТІ,"Миколаївська обл., Вознесенський р-н, село Прибужжя, вул.Соборна, будинок 52/А",Миколаївська,48076048.0,shelter
210424-FB33A1FA,2024-04-22T07:38:46.383893Z,pending,Капітальний ремонт ПРУ Березанського ліцею Березанської селищної ради. Коригування,4376624,БЕРЕЗАНСЬКА СЕЛИЩНА РАДА,"Миколаївська обл., Миколаївський р-н, селище міського типу Березанка, вул.Центральна, будинок 33",Миколаївська,2435641.7,shelter
220424-05076E0D,2024-04-22T19:44:01.697520Z,unsuccessful,"«Капітальний ремонт підвальних приміщень з пристосуванням їх як найпростіше укриття в Ворожбянському ліцеї (опорному закладі) Ворожбянської міської ради Сумської області по вулиці Центральна, 22, міста Ворожба, Сумського району, Сумської області»",43929595,"ВІДДІЛ ОСВІТИ, КУЛЬТУРИ, СІМ’Ї, МОЛОДІ ТА СПОРТУ ВОРОЖБЯНСЬКОЇ МІСЬКОЇ РАДИ","Сумська обл., Сумський р-н, місто Ворожба, вул.Центральна, будинок 22",Сумська,7232408.0,shelter
220424-558B032D,2024-04-23T13:53:37.163538Z,active,Протирадіаційне укриття ЗОШ № 88,33836176,ДЕПАРТАМЕНТ ЖИТЛОВО-КОМУНАЛЬНОГО ГОСПОДАРСТВА ТА БУДІВНИЦТВА ЗАПОРІЗЬКОЇ ОБЛАСНОЇ ДЕРЖАВНОЇ АДМІНІСТРАЦІЇ,"Запорізька обл., місто Запоріжжя, ПРОСПЕКТ СОБОРНИЙ, будинок 164",Запорізька,79598071.0,shelter
220424-669ADD1C,2024-04-26T12:50:18.550528Z,approval,"Нове будівництво укриття для закладу освіти Куяльницької сільської ради Подільського району Одеської області за адресою: вул. Шкільна, 20 с.Нестоїта",41882571,"ВІДДІЛ ЖИТЛОВО-КОМУНАЛЬНОГО ГОСПОДАРСТВА, БУДІВНИЦТВА, БЛАГОУСТРОЮ ТА РОЗВИТКУ ІНФРАСТРУКТУРИ КУЯЛЬНИЦЬКОЇ СІЛЬСЬКОЇ РАДИ ПОДІЛЬСЬКОГО РАЙОНУ ОДЕСЬКОЇ ОБЛАСТІ","Одеська обл., Подільський р-н, село Куяльник, ВУЛИЦЯ КУЯЛЬНИЦЬКА, будинок 26-А",Одеська,23358476.0,shelter
220424-70DDCF5E,2024-04-23T09:22:40.462720Z,active,"Нове будівництво споруди подвійного призначення з захистнимивластивостями протирадіакційного укриття КЗ ""Тупичівський ліцей"" Тупичівської сільської ради за адресою: Чернігівська область Чернігівський район с.Тупичів вул. Чернігівська,40",4415235,ТУПИЧІВСЬКА СІЛЬСЬКА РАДА,"Чернігівська обл., Чернігівський р-н, село Тупичів, вул.Чернігівська, будинок 75",Чернігівська,22848301.8,shelter
220424-9EFAF320,2024-04-23T11:15:21.195634Z,pending,Укриття,44155417,"ВІДДІЛ ОСВІТИ, КУЛЬТУРИ, МОЛОДІ ТА СПОРТУ ОЛЕКСАНДРІВСЬКОЇ СЕЛИЩНОЇ РАДИ","Миколаївська обл., Вознесенський р-н, селище міського типу Олександрівка, вул.Подзігуна генерала, будинок 208",Миколаївська,21546440.4,shelter
220424-AB7E23B4,2024-04-23T15:31:10.046033Z,withdrawn,укриття,2146222,"УПРАВЛІННЯ ОСВІТИ, МОЛОДІ ТА СПОРТУ ЛОЗІВСЬКОЇ МІСЬКОЇ РАДИ ХАРКІВСЬКОЇ ОБЛАСТІ","Харківська обл., місто Лозова, МІКРОРАЙОН 1, будинок 1",Харківська,119849.0,shelter
220424-F8088524,2024-04-22T12:17:49.952653Z,approval,Будівля погребу вхідного Котелевського опорного закладу загальної середньої освіти Котелевської селищної ради з облаштуванням захисної споруди цивільного захисту (споруди подвійного призначення),13955812,КОТЕЛЕВСЬКА СЕЛИЩНА РАДА,"Полтавська обл., Полтавський р-н, селище міського типу Котельва, вул.Полтавський шлях, будинок 221",Полтавська,7723946.0,shelter
230424-0331FB6E,2024-04-24T12:47:51.692649Z,active,"Капітальний ремонт протирадіаційного укриття (ПРУ) Буринського міського ліцею №2 імені Ю.М. Лавошника Буринської міської ради Сумської області за адресою: м. Буринь, вул. Шевченка, 2, Конотопський район, Сумська область (коригування)",41825775,"УПРАВЛІННЯ ОСВІТИ, МОЛОДІ, СПОРТУ, КУЛЬТУРИ ТА ТУРИЗМУ БУРИНСЬКОЇ МІСЬКОЇ РАДИ","Сумська обл., Конотопський р-н, місто Буринь, вул.Першотравнева, будинок 1",Сумська,13188305.0,shelter
230424-089E5908,2024-04-23T18:31:47.475737Z,active,Захисна споруда цивільного захисту на території Близнюківського ліцею,4400021,БЛИЗНЮКІВСЬКА СЕЛИЩНА РАДА ЛОЗІВСЬКОГО РАЙОНУ ХАРКІВСЬКОЇ ОБЛАСТІ,"Харківська обл., Близнюківський р-н, селище міського типу Близнюки, ВУЛИЦЯ СВОБОДИ, будинок 30",Харківська,103061303.0,shelter
230424-116EC513,2024-04-24T06:22:54.075425Z,withdrawn,укриття,2146222,"УПРАВЛІННЯ ОСВІТИ, МОЛОДІ ТА СПОРТУ ЛОЗІВСЬКОЇ МІСЬКОЇ РАДИ ХАРКІВСЬКОЇ ОБЛАСТІ","Харківська обл., місто Лозова, МІКРОРАЙОН 1, будинок 1",Харківська,79573.1,shelter
230424-1F07C8DE,2024-04-23T12:25:54.512007Z,approval,"Нове будівництво захисної споруди цивільного захисту на території Комунального закладу « Богодухівський ліцей №1» Богодухівської міської ради Богодухівського району Харківської області за адресою : 62103, Харківська область, м. Богодухів, площа Каразіна,14",44104781,"Управління освіти, молоді та спорту Богодухівської міської ради Харківської області","Україна, Харківська обл., Богодухівський р-н, місто Богодухів, вул.Троїцька, будинок 15",Харківська,84553307.2,shelter
