submission_code,submission_date,submission_status,submission_description,initiator_id,initiator_legalname,initiator_address,initiator_region,item_amount,item_classification
280524-12F7C2E7,2024-05-31T13:54:10.395690Z,pending,Харчоблок та обідня зала Іванівського ліцею Петриківської селищної ради,42664633,"УПРАВЛІННЯ ОСВІТИ, МОЛОДІ ТА СПОРТУ ПЕТРИКІВСЬКОЇ СЕЛИЩНОЇ РАДИ","Дніпропетровська обл., Дніпровський р-н, селище міського типу Петриківка, пр.Калнишевського Петра, будинок 71",Дніпропетровська,10974400.0,kitchen
280524-13DE84A6,2024-05-31T12:38:08.224987Z,pending,"Капітальний ремонт будівлі їдальні та овочесховища під опорну кухню на території гімназії імені Дмитра Конокеєнка Подільської міської ради Подільського району Одеської області за адресою: Одеська область, м. Подільськ, вул. Бочковича, 4а",33909986,ПОДІЛЬСЬКА МІСЬКА РАДА ПОДІЛЬСЬКОГО РАЙОНУ ОДЕСЬКОЇ ОБЛАСТІ,"Одеська обл., місто Подільськ, ПРОСПЕКТ ШЕВЧЕНКА , будинок 2",Одеська,25744559.0,kitchen
280524-160B6420,2024-05-30T05:10:34.770013Z,pending,Динівецький ліцей Новоселицької міської ради Чернівецького району Чернівецької області,44047954,ВІДДІЛ ОСВІТИ НОВОСЕЛИЦЬКОЇ МІСЬКОЇ РАДИ ЧЕРНІВЕЦЬКОГО РАЙОНУ ЧЕРНІВЕЦЬКОЇ ОБЛАСТІ,"Чернівецька обл., Новоселицький р-н, місто Новоселиця(з), вул.Центральна, будинок 47",Чернівецька,4543576.0,kitchen
280524-1DDF62F5,2024-05-30T10:54:55.768712Z,pending,Опорний заклад Диканська загальноосвітня школа І-ІІІ ступенів Диканської селищної ради Полтавського району Полтавської області,44127746,"ВІДДІЛ ОСВІТИ, СІМ'Ї, МОЛОДІ ТА СПОРТУ ДИКАНСЬКОЇ СЕЛИЩНОЇ РАДИ","Полтавська обл., Полтавський р-н, селище міського типу Диканька, вул.Незалежності, будинок 117",Полтавська,5422257.0,kitchen
280524-1FC98E43,2024-05-31T12:05:14.504238Z,withdrawn,"Капітальний ремонт будівлі їдальні та овочесховища під опорну кухню на території гімназії імені Дмитра Конокеєнка Подільської міської ради Подільського району Одеської області за адресою: Одеська область, м. Подільськ, вул. Бочковича, 4а",33909986,ПОДІЛЬСЬКА МІСЬКА РАДА ПОДІЛЬСЬКОГО РАЙОНУ ОДЕСЬКОЇ ОБЛАСТІ,"Одеська обл., місто Подільськ, ПРОСПЕКТ ШЕВЧЕНКА , будинок 2",Одеська,25744559.0,kitchen
280524-207A77E9,2024-05-30T07:15:31.644767Z,pending,"Капітальний ремонт приміщень харчоблоку Давидівської ЗОШ І-ІІІ ступенів по вул.Центральна, 130 в с.Давидівка Чернівецького району Чернівецької області",4062179,СТОРОЖИНЕЦЬКА МІСЬКА РАДА ЧЕРНІВЕЦЬКОГО РАЙОНУ ЧЕРНІВЕЦЬКОЇ ОБЛАСТІ,"Чернівецька обл., Чернівецький р-н, місто Сторожинець, вул.Чернівецька, будинок 6 А",Чернівецька,1555439.0,kitchen
280524-242F3465,2024-05-31T11:02:07.120501Z,pending,Капітальний ремонт харчоблоку Миколаївського ліцею №40,26565573,МИКОЛАЇВСЬКА МІСЬКА РАДА,"Миколаївська обл., місто Миколаїв, ВУЛИЦЯ АДМІРАЛЬСЬКА, будинок 20",Миколаївська,20976134.1,kitchen
280524-283CE2FD,2024-05-29T09:16:16.315136Z,pending,"Капітальний ремонт харчоблоку в будівлі Комунальної установи Сумська спеціалізована школи І-ІІІ ступенів №25, м. Суми Сумської області за адресою: Сумська область, м. Суми, вул. Декабристів, 80",21117479,"КОМУНАЛЬНА УСТАНОВА СУМСЬКА СПЕЦІАЛІЗОВАНА ШКОЛА І-ІІІ СТУПЕНІВ №25, М. СУМИ СУМСЬКОЇ ОБЛАСТІ","Сумська обл., місто Суми, вул.Декабристів, будинок 80",Сумська,10815215.0,kitchen
280524-2C78A36D,2024-05-28T13:33:57.447999Z,pending,"Капітальний  ремонт їдальні Вишгородського ліцею ""Сузір'я"" Вишгородської міської ради, що знаходиться за адресою: м. Вишгород, вул. Кургузова 15",13737082,"ВИШГОРОДСЬКИЙ ЛІЦЕЙ ""СУЗІР'Я"" ВИШГОРОДСЬКОЇ МІСЬКОЇ РАДИ","Київська обл., Вишгородський р-н, місто Вишгород, ВУЛИЦЯ КУРГУЗОВА, будинок 15",Київська,12600000.0,kitchen
280524-2E67D5F0,2024-05-31T11:08:08.148272Z,pending,"Капітальний ремонт харчлоблоку в ЗЗСО№4 по вул. Ізмаїльська, 130, м. Білгород-Дністровський, Одеської області.Коригування",20989154,УПРАВЛІННЯ ОСВІТИ БІЛГОРОД-ДНІСТРОВСЬКОЇ МІСЬКОЇ РАДИ,"Одеська обл., місто Білгород-Дністровський, ВУЛИЦЯ МИХАЙЛІВСЬКА, будинок 29",Одеська,2668305.0,kitchen
280524-2EE6DDA4,2024-05-30T10:47:35.431628Z,pending,Дунаєвецький ліцей №3 Дунаєвецької міської ради Хмельницької області,40216423,"УПРАВЛІННЯ ОСВІТИ, МОЛОДІ ТА СПОРТУ ДУНАЄВЕЦЬКОЇ МІСЬКОЇ РАДИ","Хмельницька обл., Кам'янець-Подільський р-н, місто Дунаївці, вул.Мистецька, будинок 16",Хмельницька,8078318.0,kitchen
280524-3FF5FD72,2024-05-31T11:14:16.790517Z,pending,Капітальний ремонт харчоблоку Миколаївська гімназія №46,26565573,МИКОЛАЇВСЬКА МІСЬКА РАДА,"Миколаївська обл., місто Миколаїв, ВУЛИЦЯ АДМІРАЛЬСЬКА, будинок 20",Миколаївська,19835683.1,kitchen
280524-41286821,2024-05-28T18:12:02.182004Z,withdrawn,Укриття,43905459,"Управління освіти, культури, молоді та спорту Садівської сільської ради Сумського району Сумської області","Сумська обл., Сумський р-н, село Сад, вул.Войти, будинок 5",Сумська,11500000.0,shelter
280524-43E44A21,2024-05-29T10:43:13.286852Z,pending,"Капітальний ремонт харчоблоку в будівлі Комунальної установи Сумської загальноосвітньої школи І-ІІІ ступенів №24, м. Суми, Сумської області за адресою: Сумська область, м. Суми, вул. Паризької Комуни, 20",23049747,"КОМУНАЛЬНА УСТАНОВА СУМСЬКА ЗАГАЛЬНООСВІТНЯ ШКОЛА І-ІІІ СТУПЕНІВ №24, М. СУМИ, СУМСЬКОЇ ОБЛАСТІ","Сумська обл., місто Суми, ВУЛИЦЯ ПАРИЗЬКОЇ КОМУНИ, будинок 20",Сумська,14926182.8,kitchen
280524-49869680,2024-05-30T07:13:30.013774Z,pending,"Капітальний ремонт приміщень харчоблоку Панківського НВК по вул.Шкільна, 2 в с.Панка Чернівецького району Чернівецької області",4062179,СТОРОЖИНЕЦЬКА МІСЬКА РАДА ЧЕРНІВЕЦЬКОГО РАЙОНУ ЧЕРНІВЕЦЬКОЇ ОБЛАСТІ,"Чернівецька обл., Чернівецький р-н, місто Сторожинець, вул.Чернівецька, будинок 6 А",Чернівецька,2588065.0,kitchen
280524-5C7C8051,2024-05-29T11:33:07.880137Z,pending,"Капітальний ремонт харчоблоку в будівлі Сумського закладу загальної середньої освіти І-ІІІ ступенів №21 Сумської міської ради за адресою: м. Суми, вул. Олега Балацького, 32",23049687,СУМСЬКИЙ ЗАКЛАД ЗАГАЛЬНОЇ СЕРЕДНЬОЇ ОСВІТИ І-ІІІ СТУПЕНІВ №21 СУМСЬКОЇ МІСЬКОЇ РАДИ,"Сумська обл., місто Суми, ВУЛИЦЯ ОЛЕГА БАЛАЦЬКОГО, будинок 32",Сумська,12282014.0,kitchen
280524-635D9EB0,2024-05-31T08:22:42.546398Z,withdrawn,"Капітальний ремонт їдальні та харчоблоку комунального закладу ""Іркліївський ліцей"" Іркліївської сільської ради Черкаської області за адресою:с.Іркліїв, вул.Гоголя, 4, Золотоніський район, Черкаська область",44160411,Відділ освіти виконавчого комітету Іркліївської сільської ради,"Черкаська обл., Золотоніський р-н, село Іркліїв, вул.Хмельницького Богдана, будинок 7",Черкаська,6451240.0,kitchen
280524-646FE4D5,2024-05-29T07:00:06.019856Z,withdrawn,Приміщення їдальні та харчоблок,4372313,ДАВИДІВСЬКА СІЛЬСЬКА РАДА ЛЬВІВСЬКОГО РАЙОНУ ЛЬВІВСЬКОЇ ОБЛАСТІ,"Львівська обл., Львівський р-н, село Давидів, вул.Незалежності, будинок 1А",Львівська,4759270.4,kitchen
280524-66061EFE,2024-05-30T13:28:36.599138Z,pending,"Капітальний ремонт харчоблоку Чудельського ліцею, Вирівської сільської ради, Сарненського району, Рівненської області за адресою: Рівненська область, Сарненський район, село Чудель, вул. Шкільна , 9",22554868,ЧУДЕЛЬСЬКИЙ ЛІЦЕЙ ВИРІВСЬКОЇ СІЛЬСЬКОЇ РАДИ САРНЕНСЬКОГО РАЙОНУ РІВНЕНСЬКОЇ ОБЛАСТІ,"Рівненська обл., Сарненський р-н, село Чудель, ВУЛИЦЯ ШКІЛЬНА, будинок 9",Рівненська,14835489.3,kitchen
280524-6BD0C592,2024-05-29T05:29:13.194943Z,pending,"""Капітальний ремонт харчоблоку комунального закладу Кагарлицької міської ради ""Кагарлицький ліцей №2, ім. В.П. Дашенка"" , за адресою: Київська область, Обухівський район, м. Кагарлик, вул. Паркова №26""",4054613,КАГАРЛИЦЬКА МІСЬКА РАДА,"Київська обл., Обухівський р-н, місто Кагарлик, вул.Героїв Небесної Сотні, будинок 1",Київська,2652000.0,kitchen
280524-700E5A69,2024-05-29T12:13:15.235397Z,pending,Харчоблок базової кухні Скориківського ліцею,44131286,"Відділ освіти, культури,молоді і спорту Скориківської сільської ради","Тернопільська обл., Тернопільський р-н, село Скорики, вул.Хмельницького Б., будинок 5А",Тернопільська,1971670.0,kitchen
280524-71135F17,2024-05-28T12:46:42.597884Z,pending,Харчоблок Сарненського ліцею №5 Сарненської міської ради,4057770,САРНЕНСЬКА МІСЬКА РАДА,"Рівненська обл., Сарненський р-н, місто Сарни, ВУЛИЦЯ ШИРОКА, будинок 31",Рівненська,7936143.0,kitchen
280524-71591D7C,2024-05-29T11:27:50.574653Z,withdrawn,"Капітальний ремонт харчоблоку в будівлі Сумського закладу загальної середньої освіти І-ІІІ ступенів №15 Сумської міської ради за адресою: Сумської області, м. Суми, вул. Берестовська,56",23049894,СУМСЬКИЙ ЗАКЛАД ЗАГАЛЬНОЇ СЕРЕДНЬОЇ ОСВІТИ І-ІІІ СТУПЕНІВ №15 СУМСЬКОЇ МІСЬКОЇ РАДИ,"Сумська обл., місто Суми, вул.Берестовська, будинок 56",Сумська,12252586.0,kitchen
280524-75CA6ABF,2024-05-31T07:27:39.656632Z,pending,харчоблок,44354422,Управління будівництва та ремонтів Южноукраїнської міської ради,"Миколаївська обл., Вознесенський р-н, місто Южноукраїнськ, вул.Європейська, будинок 23, кабінет 87",Миколаївська,6301590.0,kitchen
280524-7FEF7F00,2024-05-30T08:49:01.365555Z,pending,"Харчоблок в комунальному закладі «Інноваційна гімназія Кропивницької міської ради», за адресою: вул. Незалежності, 28/20, м. Кропивницький",4055251,ВИКОНАВЧИЙ КОМІТЕТ КРОПИВНИЦЬКОЇ МІСЬКОЇ РАДИ,"Кіровоградська обл., місто Кропивницький, ВУЛИЦЯ ВЕЛИКА ПЕРСПЕКТИВНА, будинок 41",Кіровоградська,10354620.0,kitchen
280524-8192D3D4,2024-05-29T09:51:14.571887Z,pending,"Капітальний ремонт їдальні з встановленням технологічного обладнання Комунальної установи Сумська загальноосвітня школа І-ІІІ ступенів №22 імені Ігоря Гольченка Сумської міської ради, за адресою: м. Суми, вул. Ковпака, 57",14014201,КОМУНАЛЬНА УСТАНОВА СУМСЬКА ЗАГАЛЬНООСВІТНЯ ШКОЛА I-III СТУПЕНІВ № 22 ІМЕНІ ІГОРЯ ГОЛЬЧЕНКА СУМСЬКОЇ МІСЬКОЇ РАДИ,"Сумська обл., місто Суми, ВУЛИЦЯ КОВПАКА, будинок 57",Сумська,13974074.0,kitchen
280524-8916BD94,2024-05-29T14:18:38.756571Z,pending,Харчоблок,23049776,"КОМУНАЛЬНА УСТАНОВА СУМСЬКА ЗАГАЛЬНООСВІТНЯ ШКОЛА І-ІІІ СТУПЕНІВ №27, М. СУМИ, СУМСЬКОЇ ОБЛАСТІ","Сумська обл., місто Суми, ВУЛИЦЯ ОХТИРСЬКА, будинок 33",Сумська,5551708.0,kitchen
280524-8D1B43EE,2024-05-30T09:51:24.438181Z,pending,"Капітальний ремонт їдальні  КЗ ""Чоповицький ліцей"" по вул. Соборна, 39 смт Чоповичі Коростенського району Житомирської області "" КОРИГУВАННЯ",4346250,ЧОПОВИЦЬКА СЕЛИЩНА РАДА,"Житомирська обл., Коростенський р-н, селище міського типу Чоповичі, вул.Вайсера, будинок 1А",Житомирська,4498890.3,kitchen
280524-8E0B49CD,2024-05-31T11:28:32.850231Z,declined,СКОЛІВСЬКИЙ ЗАКЛАД ЗАГАЛЬНОЇ СЕРЕДНЬОЇ ОСВІТИ І-ІІІ СТУПЕНІВ №3 СКОЛІВСЬКОЇ МІСЬКОЇ РАДИ,4056262,СКОЛІВСЬКА МІСЬКА РАДА,"Львівська обл., Стрийський р-н, місто Сколе, майдан Незалежності, будинок 1",Львівська,5517600.0,kitchen
280524-8EBF5BB6,2024-05-31T17:03:44.038925Z,pending,харчоблок Градизької гімназії імені Героя України Олександра Білаша,43922872,"ВІДДІЛ ОСВІТИ, КУЛЬТУРИ, МОЛОДІ ТА СПОРТУ ВИКОНАВЧОГО КОМІТЕТУ ГРАДИЗЬКОЇ СЕЛИЩНОЇ РАДИ КРЕМЕНЧУЦЬКОГО РАЙОНУ ПОЛТАВСЬКОЇ ОБЛАСТІ","Полтавська обл., Кременчуцький р-н, селище міського типу Градизьк, вул.Гвардійська, будинок 71",Полтавська,9673236.0,kitchen
280524-91419AC6,2024-05-29T07:53:40.116098Z,withdrawn,"Реконструкція приміщень харчоблоку у школі № 8 ДМР, м. Дніпро",40506248,ДЕПАРТАМЕНТ ГУМАНІТАРНОЇ ПОЛІТИКИ ДНІПРОВСЬКОЇ МІСЬКОЇ РАДИ,"Дніпропетровська обл., місто Дніпро, пр.Яворницького Дмитра, будинок 75",Дніпропетровська,7277811.0,kitchen
280524-9A6B64EE,2024-05-29T13:30:28.903578Z,pending,"Харчоблок Таращанського академічного ліцею ""Успіх"" Таращанської міської ради Київської області",44035446,Відділ освіти Таращанської міської ради,"Київська обл., Таращанський р-н, місто Тараща(з), вул.Шевченка, будинок 16",Київська,9263471.0,kitchen
280524-9F30ED71,2024-05-29T08:44:04.332093Z,withdrawn,Капітальний ремонт їдальні та харчоблоку школи,4057600,УПРАВЛІННЯ КАПІТАЛЬНОГО БУДІВНИЦТВА ПОЛТАВСЬКОГО МІСЬКВИКОНКОМУ,"Полтавська обл., місто Полтава, ВУЛИЦЯ СОБОРНОСТІ, будинок 36",Полтавська,15086871.0,kitchen
280524-A6EDD2C0,2024-05-29T07:59:04.152441Z,withdrawn,Капітальний ремонт харчоблоку та їдальні,44104357,ВІДДІЛ ОСВІТИ РІПКИНСЬКОЇ СЕЛИЩНОЇ РАДИ ЧЕРНІГІВСЬКОГО РАЙОНУ ЧЕРНІГІВСЬКОЇ ОБЛАСТІ,"Чернігівська обл., Чернігівський р-н, селище міського типу Ріпки, вул.Святомиколаївська, будинок 92",Чернігівська,7232922.0,kitchen
280524-B290AFA1,2024-05-29T08:29:06.569039Z,pending,Капітальний ремонт приміщень їдальні в Пухівському закладі загальної середньої освіти Зазимської сільської ради Броварського району Київської області,4363876,ЗАЗИМСЬКА СІЛЬСЬКА РАДА БРОВАРСЬКОГО РАЙОНУ КИЇВСЬКОЇ ОБЛАСТІ,"Київська обл., Броварський р-н, село Зазим'я, вул.Широка, будинок 6",Київська,5017384.0,kitchen
280524-B3876BE5,2024-05-30T13:47:13.645684Z,pending,"Капітальний ремонт харчоблоку Ясногірського ліцею, Вирівської сільської ради, Сарненського району, Рівненської області за адресою: Рівненська область, Сарненський район, село Ясногірка, вул. 40-річчя Перемоги,1",33213916,ЯСНОГІРСЬКИЙ ЛІЦЕЙ ВИРІВСЬКОЇ СІЛЬСЬКОЇ РАДИ САРНЕНСЬКОГО РАЙОНУ РІВНЕНСЬКОЇ ОБЛАСТІ,"Рівненська обл., Сарненський р-н, село Ясногірка, вул.40-річчя Перемоги, будинок 1",Рівненська,17157349.5,kitchen
280524-C14ADF5F,2024-05-31T11:35:33.930945Z,pending,Приміщення харчоблоку Аджамського ліцею Аджамської сільської ради Кропивницького району Кіровоградської області,43919723,"ВІДДІЛ ОСВІТИ, МОЛОДІ ТА СПОРТУ, КУЛЬТУРИ ТА ТУРИЗМУ АДЖАМСЬКОЇ СІЛЬСЬКОЇ РАДИ","Кіровоградська обл., Кропивницький р-н, село Аджамка(пн), вул.Центральна, будинок 65",Кіровоградська,6049824.7,kitchen
280524-C9BDE5F1,2024-05-31T10:51:21.905631Z,pending,"Капітальний ремонт харчоблоку Миколаївської гімназії №52 Миколаївської міської ради Миколаївської області за адресою: м. Миколаїв, вул. Крилова, 42""",26565573,МИКОЛАЇВСЬКА МІСЬКА РАДА,"Миколаївська обл., місто Миколаїв, ВУЛИЦЯ АДМІРАЛЬСЬКА, будинок 20",Миколаївська,19554074.0,kitchen
280524-CB77F362,2024-05-29T09:59:07.879295Z,withdrawn,"Реконструкція приміщень харчоблоку у школі № 147 ДМР, м. Дніпро",40506248,ДЕПАРТАМЕНТ ГУМАНІТАРНОЇ ПОЛІТИКИ ДНІПРОВСЬКОЇ МІСЬКОЇ РАДИ,"Дніпропетровська обл., місто Дніпро, пр.Яворницького Дмитра, будинок 75",Дніпропетровська,7030928.0,kitchen
280524-CDE3FE06,2024-05-28T11:38:18.352158Z,approval,"«Капітальний ремонт споруди цивільного захисту (протирадіаційного укриття) Царичанського ліцею Царичанської селищної ради за адресою : селище Царичанка, вул.Орільська,9 Дніпровського району Дніпропетровської області». Коригування",41428297,ВІДДІЛ ОСВІТИ ВИКОНАВЧОГО КОМІТЕТУ ЦАРИЧАНСЬКОЇ СЕЛИЩНОЇ РАДИ,"Дніпропетровська обл., Дніпровський р-н, селище міського типу Царичанка, вул.Соборна, будинок 40-А",Дніпропетровська,5590.0,shelter
280524-D1C2FF17,2024-05-30T08:44:57.230772Z,pending,"Харчоблок в комунальному закладі ""Академічна гімназія Кропивницької міської ради"" за адресою: проспект Перемоги, 16, м. Кропивницький"" коригування",4055251,ВИКОНАВЧИЙ КОМІТЕТ КРОПИВНИЦЬКОЇ МІСЬКОЇ РАДИ,"Кіровоградська обл., місто Кропивницький, ВУЛИЦЯ ВЕЛИКА ПЕРСПЕКТИВНА, будинок 41",Кіровоградська,10315147.0,kitchen
280524-D44040C6,2024-05-29T08:01:16.786038Z,withdrawn,"Реконструкція приміщень харчоблоку у школі № 46, м. Дніпро",40506248,ДЕПАРТАМЕНТ ГУМАНІТАРНОЇ ПОЛІТИКИ ДНІПРОВСЬКОЇ МІСЬКОЇ РАДИ,"Дніпропетровська обл., місто Дніпро, пр.Яворницького Дмитра, будинок 75",Дніпропетровська,7781307.0,kitchen
280524-D8E8CA30,2024-05-31T07:25:23.718508Z,pending,Харчоблок,44354422,Управління будівництва та ремонтів Южноукраїнської міської ради,"Миколаївська обл., Вознесенський р-н, місто Южноукраїнськ, вул.Європейська, будинок 23, кабінет 87",Миколаївська,5942512.0,kitchen
280524-DE0337E6,2024-05-30T07:33:33.196983Z,pending,"Комунальний заклад ""Кам'янський ліцей №1 Кам'янської міської ради Черкаської області""",41823673,"ВІДДІЛ ОСВІТИ, КУЛЬТУРИ, МОЛОДІ ТА СПОРТУ ВИКОНАВЧОГО КОМІТЕТУ КАМ’ЯНСЬКОЇ МІСЬКОЇ РАДИ","Черкаська обл., Кам'янський р-н, місто Кам'янка, ВУЛИЦЯ ГЕРОЇВ МАЙДАНУ, будинок 37",Черкаська,5501604.0,kitchen
